scaffold	begin	end	transposable	taxonomy	vog
NZ_CP018421.1	2344640	2385051	False	Siphoviridae	VOG4743, VOG8390, VOG1539, VOG5277, VOG4910, VOG4675, VOG0267, VOG0267, VOG9276, VOG0376, VOG2545, VOG8399, VOG4228, VOG8343, VOG4127, VOG8398, VOG2119, VOG4568, VOG8395, VOG2641, VOG4704, VOG5830, VOG3480, VOG1329, VOG4611, VOG4731, VOG8397, VOG4564, VOG1518, VOG7407, VOG5620, VOG5607, VOG10923, VOG7528, VOG9626, VOG6868, VOG5622, VOG8427, VOG5375, VOG0107, VOG4571, VOG8394, VOG10933
NZ_CP018421.1	2680782	2702869	False	Siphoviridae	VOG4565, VOG0765, VOG4743, VOG8390, VOG1539, VOG5277, VOG4860, VOG9276, VOG4729, VOG3427, VOG0704, VOG9583, VOG4589, VOG0204, VOG5259, VOG4553, VOG4568, VOG4556, VOG5779, VOG0425, VOG6182, VOG0292
NZ_CP018421.1	2722290	2750376	False	Siphoviridae	VOG5412, VOG4743, VOG8390, VOG1539, VOG5277, VOG4910, VOG9584, VOG4603, VOG8399, VOG4228, VOG5260, VOG4127, VOG8398, VOG2119, VOG4568, VOG8395, VOG4704, VOG5830, VOG3480, VOG1329, VOG4555, VOG4731, VOG10130, VOG8397, VOG4564, VOG1518, VOG6488, VOG5620, VOG5607, VOG10923
NZ_CP018421.1	2758859	2764372	False	Unknown	VOG9625, VOG9624, VOG8392, VOG9564, VOG7510
NZ_CP018421.1	2985096	2987006	False	Unknown	VOG2337, VOG2336, VOG7122
