scaffold	begin	end	transposable	taxonomy	vog
NZ_CP065867.1	661490	683514	False	Siphoviridae	VOG8347, VOG2215, VOG0585, VOG0198, VOG3721, VOG6174, VOG6173, VOG3427, VOG3428, VOG4735, VOG0847, VOG0848, VOG0850, VOG4701, VOG4598, VOG5820, VOG9340, VOG4365, VOG0980, VOG9340, VOG4365, VOG0980
NZ_CP065867.1	1243292	1271145	False	Myoviridae / Siphoviridae	VOG5611, VOG8347, VOG9349, VOG10933, VOG2186, VOG0585, VOG4609, VOG7152, VOG10525, VOG0051, VOG1933, VOG0833, VOG4573, VOG3434, VOG0976, VOG2167, VOG4545, VOG10071
NZ_CP065867.1	3670618	3721551	False	Siphoviridae	VOG3448, VOG6173, VOG6174, VOG0614, VOG6394, VOG7568, VOG4743, VOG3179, VOG1539, VOG5277, VOG4545, VOG2473, VOG5601, VOG2471, VOG2469, VOG2468, VOG6400, VOG2467, VOG5296, VOG2466, VOG5027, VOG2464, VOG7470, VOG6488, VOG5620, VOG5607, VOG2125, VOG2388, VOG7106, VOG9739, VOG0296, VOG0292, VOG0585, VOG6989, VOG6891, VOG0355, VOG4566, VOG3307, VOG2069, VOG7530, VOG4567, VOG5995, VOG4861, VOG4945, VOG0321, VOG9738, VOG9737, VOG8467, VOG8466, VOG5472, VOG6057, VOG6128, VOG6990, VOG0942, VOG8243, VOG6256, VOG0275
NZ_CP065867.1	4636265	4640774	False	Unknown	VOG5562, VOG5998, VOG0025
NZ_CP065867.1	5036388	5072487	False	Siphoviridae	VOG10071, VOG4545, VOG2167, VOG0976, VOG3434, VOG4573, VOG0833, VOG1933, VOG0051, VOG10525, VOG7152, VOG2125, VOG2388, VOG6223, VOG0585, VOG2186, VOG4829, VOG0020, VOG2186, VOG8347, VOG2337, VOG2336, VOG2531, VOG3617, VOG4658, VOG5531, VOG8348
