scaffold	begin	end	transposable	taxonomy	vog
NZ_CP034409.1	867161	883094	True	Siphoviridae	VOG0275, VOG2819, VOG0377, VOG0275, VOG0275, VOG0275, VOG8347, VOG7465
NZ_CP034409.1	3812223	3814600	False	Siphoviridae	VOG2039, VOG2485, VOG9481
NZ_CP034409.1	5298360	5311934	True	Myoviridae	VOG0944, VOG0944, VOG4548, VOG0382, VOG0083, VOG5235
NZ_CP034409.1	6023091	6044064	False	Myoviridae	VOG8347, VOG2215, VOG0585, VOG0198, VOG0977, VOG0573, VOG4550, VOG4691, VOG0574, VOG6373, VOG2073, VOG0356, VOG0577, VOG8340, VOG4130, VOG4736, VOG0569, VOG0582, VOG3721, VOG6174, VOG6173
NZ_CP034409.1	6681003	6719383	False	Siphoviridae	VOG2153, VOG6855, VOG4791, VOG3992, VOG8525, VOG8526, VOG8527, VOG4892, VOG3993, VOG3995, VOG10952, VOG3998, VOG10847, VOG3999, VOG3556, VOG4001, VOG10848, VOG4795, VOG8528, VOG4002, VOG4003, VOG4004, VOG4005, VOG4005, VOG4544, VOG1356, VOG4652, VOG0572, VOG4807, VOG8529, VOG3178, VOG0438, VOG2165, VOG2166, VOG2167, VOG2168, VOG9868, VOG6163, VOG2170, VOG2171, VOG2172, VOG2172, VOG1418, VOG1474, VOG1419, VOG4780, VOG0980
