scaffold	begin	end	transposable	taxonomy	vog
NZ_CP066016.1	227716	236692	False	Myoviridae	VOG8233, VOG4708, VOG0415, VOG7126, VOG6971, VOG9625, VOG0010, VOG2338, VOG6557, VOG4566, VOG0025, VOG3490
NZ_CP066016.1	242881	269131	False	Siphoviridae	VOG10923, VOG5607, VOG5620, VOG7407, VOG1518, VOG4564, VOG8396, VOG8397, VOG2483, VOG4611, VOG1329, VOG3480, VOG5830, VOG4704, VOG8395, VOG4568, VOG2119, VOG8398, VOG4127, VOG8343, VOG4228, VOG8399, VOG0233, VOG10059, VOG2977, VOG0047, VOG4910, VOG5277
NZ_CP066016.1	1545105	1552868	False	Unknown	VOG6633, VOG6932, VOG1915, VOG6269, VOG5027, VOG1912
NZ_CP066016.1	2708866	2712755	True	Unknown	VOG11015, VOG0275, VOG0944
NZ_CP066016.1	3711882	3752218	False	Siphoviridae	VOG0195, VOG9625, VOG2215, VOG6557, VOG4566, VOG0025, VOG3490, VOG4567, VOG5622, VOG11033, VOG9628, VOG9577, VOG0327, VOG0156, VOG9566, VOG5156, VOG0292, VOG10923, VOG5607, VOG5620, VOG6488, VOG1518, VOG4564, VOG8397, VOG10130, VOG4731, VOG1329, VOG3480, VOG5830, VOG4704, VOG4568, VOG2119, VOG8398, VOG4127, VOG8343, VOG4228, VOG8399, VOG4603, VOG9567, VOG0267, VOG0267, VOG4675, VOG8382, VOG8399, VOG5277, VOG1539
